,city,hotel_name,hotel_address,hotel_general_review,hotel_rating,numbers_of_reviews,hotel_facilities,hotel_description,url_booking_hotel,lat_hotel,lon_hotel
126,Saintes Maries de la mer,Hotel Lou Marquès," 6 Rue du Vibre, 13460 Saintes-Maries-de-la-Mer, France ",Wonderful,9.0,163 reviews,"['Free parking', 'Free WiFi', 'Family rooms', 'Facilities for disabled guests', 'Non-smoking rooms', 'Room service', 'Breakfast', 'Free parking', 'Free WiFi', 'Family rooms', 'Facilities for disabled guests', 'Non-smoking rooms', 'Room service', 'Breakfast', 'Toilet paper', 'Towels', 'Private Bathroom', 'Toilet', 'Free toiletries', 'Hairdryer', 'Shower', 'Wardrobe or closet', 'City view', 'Outdoor furniture', 'Sun deck', 'Terrace', 'Socket near the bed', 'Tour or class about local culture', 'Bike tours', 'Walking tours', 'Horseback riding', 'Cycling', 'Hiking', 'Canoeing', 'Fishing', 'Desk', 'Flat-screen TV', 'TV', 'Coffee house on site', 'Street parking', 'Accessible parking', 'Fax/Photocopying', 'Express check-in/out', 'Room service', 'Fire extinguishers', 'CCTV in common areas', 'Smoke alarms', 'Safe', 'Designated smoking area', 'Air conditioning', 'Smoke-free property', 'Hypoallergenic room available', 'Heating', 'Family rooms', 'Facilities for disabled guests', 'Non-smoking rooms', 'Toilet with grab rails', 'Wheelchair accessible', 'Beach umbrellas', 'English', 'Spanish', 'French', 'Italian']","Lou Marquès is located in Les Saintes Maries De La Mer, in Camargue Regional Nature Park.  It offers free WiFi and a sunny terrace and it is just 1312 feet from the beaches.

All the air-conditioned rooms at Lou Marquès come with an LCD TV and a telephone. They all have a private bathroom with a shower and some of them also include a private terrace.

You may have your breakfast served in the communal lounge or take it on the terrace. You can ask the reception about the nearest restaurants.

Free public parking is available on site and the hotel is a 5-minute drive from Pont de Gau Ornithological Park. Arles is a 30-minute drive away.",https://www.booking.com/hotel/fr/lou-marques.html?label=gen173nr-1FEgZzZWFyY2goggI46AdIM1gEaK0CiAEBmAExuAEYyAEV2AEB6AEB-AECiAIBqAIEuAK8j6yrBsACAdICJDFjNzg0MjIyLTZlODctNDg5Yi04ZGUxLTI0NTg1OTM0MTUwM9gCBeACAQ&sid=92f3b495119c1eee67254154eb729221&aid=304142&ucfs=1&arphpl=1&dest_id=-1465138&dest_type=city&group_adults=2&req_adults=2&no_rooms=1&group_children=0&req_children=0&hpos=12&hapos=12&sr_order=popularity&srpvid=68a64a1ee69b0161&srepoch=1701513151&from_sustainable_property_sr=1&from=searchresults,43.45512494,4.42874014
127,Saintes Maries de la mer,Hotel Camille," 13, Avenue de la plage, 13460 Saintes-Maries-de-la-Mer, France ",Very Good,8.0,973 reviews,"['Free parking', 'Free WiFi', 'Family rooms', 'Beachfront', 'Facilities for disabled guests', 'Non-smoking rooms', 'Bar', 'Breakfast', 'Free parking', 'Free WiFi', 'Family rooms', 'Beachfront', 'Facilities for disabled guests', 'Non-smoking rooms', 'Bar', 'Breakfast', 'Toilet paper', 'Towels', 'Towels/Sheets (extra fee)', 'Private Bathroom', 'Toilet', 'Free toiletries', 'Hairdryer', 'Wardrobe or closet', 'Outdoor furniture', 'Beachfront', 'Sun deck', 'Terrace', 'Socket near the bed', 'Bike tours', 'Walking tours', 'Beach', 'Water sports facilities on site', 'Mini golf', 'Horseback riding', 'Cycling', 'Hiking', 'Fishing', 'Flat-screen TV', 'Cable channels', 'TV', 'Coffee house on site', 'Wine/Champagne', 'Bar', 'Street parking', 'Accessible parking', 'Pet basket', 'Daily housekeeping', 'Vending machine (drinks)', 'Baggage storage', 'Invoice provided', 'Baby safety gates', 'Board games/Puzzles', 'Fire extinguishers', 'CCTV in common areas', 'Smoke alarms', 'Security alarm', 'Key access', 'Safe', 'Air conditioning', 'Smoke-free property', 'Heating', 'Private entrance', 'Soundproof rooms', 'Family rooms', 'Facilities for disabled guests', 'Non-smoking rooms', 'Beach umbrellas', 'English', 'French']","This air-conditioned hotel featuring a terrace is located on the beachfront in Saintes-Maries-de-la-Mer, 22 mi from Arles. Free Wi-Fi access and an LCD TV are offered in the modern rooms.

Each room has a private bathroom with a hairdryer and free toiletries. Some of the rooms have air conditioning, a terrace or a view of the sea.

A buffet breakfast is available every morning at Hotel Camille. You can also enjoy a drink in the hotel bar.

Horse-riding and tennis are among the activities available in the local area. Free public parking is possible nearby and the property has a motorbike/bike garage that guests can use free of charge.",https://www.booking.com/hotel/fr/camille.html?label=gen173nr-1FEgZzZWFyY2goggI46AdIM1gEaK0CiAEBmAExuAEYyAEV2AEB6AEB-AECiAIBqAIEuAK8j6yrBsACAdICJDFjNzg0MjIyLTZlODctNDg5Yi04ZGUxLTI0NTg1OTM0MTUwM9gCBeACAQ&sid=92f3b495119c1eee67254154eb729221&aid=304142&ucfs=1&arphpl=1&dest_id=-1465138&dest_type=city&group_adults=2&req_adults=2&no_rooms=1&group_children=0&req_children=0&hpos=11&hapos=11&sr_order=popularity&srpvid=68a64a1ee69b0161&srepoch=1701513151&from_sustainable_property_sr=1&from=searchresults,43.45039148,4.42991227
128,Saintes Maries de la mer,La Tramontane," 94 Chemin Bas de Dromar, 13460 Saintes-Maries-de-la-Mer, France ",Wonderful,9.0,"1,442 reviews","['Outdoor swimming pool', 'Free parking', 'Free WiFi', 'Family rooms', 'Non-smoking rooms', 'Bar', 'Wonderful Breakfast', 'Outdoor swimming pool', 'Free parking', 'Free WiFi', 'Family rooms', 'Non-smoking rooms', 'Bar', 'Wonderful Breakfast', 'Outdoor furniture', 'Sun deck', 'Terrace', 'Garden', 'Bicycle rental', 'Themed dinners', 'Walking tours', 'Evening entertainment', 'Horseback riding', 'Cycling', 'Hiking', 'Pool table', 'Game room', 'Coffee house on site', 'Fruit', 'Wine/Champagne', 'Special diet meals (on request)', 'Snack bar', 'Breakfast in the room', 'Bar', 'Parking garage', 'Electric vehicle charging station', 'Accessible parking', 'Public transit tickets', 'Invoice provided', 'Private check-in/out', 'Baggage storage', 'Tour desk', 'Express check-in/out', 'Strollers', 'Board games/Puzzles', 'Babysitting/Child services', 'Daily housekeeping', 'Ironing service', 'Laundry', 'Fax/Photocopying', 'Business center', 'Meeting/Banquet facilities', 'Fire extinguishers', 'CCTV outside property', 'CCTV in common areas', 'Key access', '24-hour security', 'Safe', 'Shared lounge/TV area', 'Designated smoking area', 'Air conditioning', 'Smoke-free property', 'Hypoallergenic room available', 'Heating', 'Car rental', 'Packed lunches', 'Soundproof rooms', 'Family rooms', 'Non-smoking rooms', 'Opening times', 'Seasonal', 'All ages welcome', 'Infinity pool', 'Shallow end', 'Pool/Beach towels', 'Beach chairs/Loungers', 'Beach umbrellas', ""Kids' pool"", 'Beach umbrellas', 'Beach chairs/Loungers', 'Open-air bath', 'German', 'English', 'Spanish', 'French']","La Tramontane welcomes you in Saintes-Maries-de-la-Mer, in the heart of the Camargues area. It offers individually-decorated rooms leading to the outdoor swimming pool, the garden and the private pond.

Soundproofed and air-conditioned, the guest rooms all feature a television and Wi-Fi access. They are decorated in a characteristic Provencal style and feature a private terrace overlooking the garden and the swimming pool.

We will have the pleasure to serve you on your terrace, at sunset, an aperitif accompanied by tapas to satisfy your gluttony or your appetite.  You can enjoy musical shows, such as the themed evening every Saturday night.

Free private secured parking is available on site.",https://www.booking.com/hotel/fr/la-tramontane.html?label=gen173nr-1FEgZzZWFyY2goggI46AdIM1gEaK0CiAEBmAExuAEYyAEV2AEB6AEB-AECiAIBqAIEuAK8j6yrBsACAdICJDFjNzg0MjIyLTZlODctNDg5Yi04ZGUxLTI0NTg1OTM0MTUwM9gCBeACAQ&sid=92f3b495119c1eee67254154eb729221&aid=304142&ucfs=1&arphpl=1&dest_id=-1465138&dest_type=city&group_adults=2&req_adults=2&no_rooms=1&group_children=0&req_children=0&hpos=10&hapos=10&sr_order=popularity&srpvid=68a64a1ee69b0161&srepoch=1701513151&from_sustainable_property_sr=1&from=searchresults,43.47260109,4.41012025
129,Saintes Maries de la mer,Les Vagues," 12 Avenue Théodore Aubanel, 13460 Saintes-Maries-de-la-Mer, France ",Excellent,8.6,316 reviews,"['Restaurant', 'Family rooms', 'Beachfront', 'Non-smoking rooms', 'Bar', 'Private beach area', 'Wonderful Breakfast', 'Restaurant', 'Family rooms', 'Beachfront', 'Non-smoking rooms', 'Bar', 'Private beach area', 'Wonderful Breakfast', 'Toilet paper', 'Bathtub or shower', 'Private Bathroom', 'Toilet', 'Free toiletries', 'Bathrobe', 'Hairdryer', 'Wardrobe or closet', 'Walk-in closet', 'Outdoor furniture', 'Beachfront', 'Sun deck', 'Private beach area', 'Terrace', 'Electric kettle', 'Clothes rack', 'Bicycle rental', 'Live music/Performance', 'Tour or class about local culture', 'Themed dinners', 'Bike tours', 'Walking tours', 'Bar crawls', 'Beach', 'Water sports facilities on site', 'Snorkeling', 'Horseback riding', 'Cycling', 'Hiking', 'Canoeing', 'Windsurfing', 'Fishing', 'Flat-screen TV', 'Cable channels', 'Coffee house on site', 'Fruit', 'Wine/Champagne', ""Kids' meals"", 'Snack bar', 'Breakfast in the room', 'Bar', 'Restaurant', 'Shuttle service', 'Private check-in/out', 'Invoice provided', 'Fire extinguishers', 'CCTV outside property', 'CCTV in common areas', 'Smoke alarms', 'Security alarm', 'Key access', '24-hour security', 'Safe', 'Designated smoking area', 'Air conditioning', 'Tile/Marble floor', 'Heating', 'Soundproof', 'Soundproof rooms', 'Fan', 'Family rooms', 'Non-smoking rooms', 'English', 'Spanish', 'French']","Featuring a restaurant, bar and views of sea, Les Vagues is located in Saintes-Maries-de-la-Mer, a 3-minute walk from Arenas Beach. The property is around a 4-minute walk from Crin Blanc Beach, 500 yards from Amphora Beach and 24 miles from Arles Amphitheatre. Guests can have a drink at the snack bar.

Complete with a private bathroom equipped with a bath or shower and free toiletries, all guest rooms at the hotel have a flat-screen TV and air conditioning, and some rooms will provide you with a terrace. All rooms will provide guests with a closet and an electric tea pot.

Guests at Les Vagues can enjoy a continental breakfast.

Activities such as hiking, snorkeling, cycling can be enjoyed in the surrounding areas, and guests can relax along the beachfront.

The nearest airport is Nimes-Ales-Camargue-Cevennes Airport, 25 miles from the accommodation.",https://www.booking.com/hotel/fr/les-vagues-saintes-maries-de-la-mer.html?label=gen173nr-1FEgZzZWFyY2goggI46AdIM1gEaK0CiAEBmAExuAEYyAEV2AEB6AEB-AECiAIBqAIEuAK8j6yrBsACAdICJDFjNzg0MjIyLTZlODctNDg5Yi04ZGUxLTI0NTg1OTM0MTUwM9gCBeACAQ&sid=92f3b495119c1eee67254154eb729221&aid=304142&ucfs=1&arphpl=1&dest_id=-1465138&dest_type=city&group_adults=2&req_adults=2&no_rooms=1&group_children=0&req_children=0&hpos=9&hapos=9&sr_order=popularity&srpvid=68a64a1ee69b0161&srepoch=1701513151&from_sustainable_property_sr=1&from=searchresults,43.450352,4.425047
130,Saintes Maries de la mer,Vila De La Mar & Spa," 1 bis rue Camille Pelletan, 13460 Saintes-Maries-de-la-Mer, France ",Very Good,8.2,442 reviews,"['Outdoor swimming pool', 'Spa', 'Restaurant', 'Free WiFi', 'Family rooms', 'Fitness center', 'Facilities for disabled guests', 'Tea/Coffee Maker in All Rooms', 'Bar', 'Very Good Breakfast', 'Outdoor swimming pool', 'Spa', 'Restaurant', 'Free WiFi', 'Family rooms', 'Fitness center', 'Facilities for disabled guests', 'Tea/Coffee Maker in All Rooms', 'Bar', 'Very Good Breakfast', 'Toilet paper', 'Towels', 'Towels/Sheets (extra fee)', 'Slippers', 'Private Bathroom', 'Toilet', 'Free toiletries', 'Bathrobe', 'Hairdryer', 'Wardrobe or closet', 'Outdoor furniture', 'Sun deck', 'Patio', 'Terrace', 'Coffee machine', 'Electric kettle', 'Bicycle rental', 'Tour or class about local culture', 'Bike tours', 'Walking tours', 'Horseback riding', 'Cycling', 'Hiking', 'Canoeing', 'Fishing', 'Desk', 'Flat-screen TV', 'Satellite channels', 'Radio', 'Telephone', 'TV', 'Coffee house on site', 'Fruit', 'Wine/Champagne', ""Kids' meals"", 'Special diet meals (on request)', 'Snack bar', 'Breakfast in the room', 'Bar', 'Minibar', 'Restaurant', 'Tea/Coffee maker', 'Invoice provided', 'Concierge', 'Baggage storage', 'Baby safety gates', 'Board games/Puzzles', 'Board games/puzzles', 'Babysitting/Child services', 'Daily housekeeping', 'Ironing service', 'Laundry', 'Meeting/Banquet facilities', 'Fire extinguishers', 'CCTV outside property', 'CCTV in common areas', 'Smoke alarms', 'Security alarm', 'Key access', '24-hour security', 'Safe', 'Shuttle service', 'Carbon monoxide detector', 'Convenience store on site', 'Designated smoking area', 'Air conditioning', 'Smoke-free property', 'Hypoallergenic room available', 'Wake-up service', 'Tile/Marble floor', 'Heating', 'Packed lunches', 'Family rooms', 'Hair/Beauty salon', 'Facilities for disabled guests', 'Non-smoking rooms', 'Iron', 'Room service', 'Raised toilet', 'Toilet with grab rails', 'Wheelchair accessible', 'Open all year', 'All ages welcome', 'Heated pool', 'Pool cover', 'Beach chairs/Loungers', 'Locker rooms', 'Fitness', 'Massage chair', 'Full-body massage', 'Hand massage', 'Head massage', 'Foot massage', 'Back massage', 'Spa/Wellness packages', 'Spa lounge/Relaxation area', 'Steam room', 'Spa facilities', 'Body wrap', 'Body scrub', 'Body treatments', 'Pedicure', 'Manicure', 'Waxing services', 'Facial treatments', 'Beauty services', 'Beach umbrellas', 'Beach chairs/Loungers', 'Open-air bath', 'Turkish/Steam Bath', 'Hot tub/Jacuzzi', 'Massage', 'Spa', 'Solarium', 'Fitness center', 'Sauna', 'English', 'Spanish', 'French', 'Italian']","Vila De La Mar & Spa is a small hotel featuring modern design located in the center of Saintes-Maries-de-la-Mer, 328 feet from the beach. There is a heated outdoor swimming pool, covered during winter, and a spa with hammam and hot tub.

Each air-conditioned room features a private terrace, a mini-bar and a large flat-screen TV with cable channels.

Guests can enjoy a  restaurant with a terrace overlooking the pool. On some weekends a dinner hosted by Gypsy guitarists and singers can be provided for a surcharge. A continental breakfast is also available and in-room breakfast is possible for a surcharge.

Activities in the area include windsurfing, horse riding and boat excursions. Vila De La Mar & Spa is surrounded by the Camargue Regional Nature Park and faces the Mediterranean Sea. Guests can also enjoy four wheel, bicycle or carriage rides during their stay.

The property is within 37 mi from both Nîmes and Garons Airports, and 75 mi from Marseille Marignane Airport. Arles Train Station is 22 mi away.",https://www.booking.com/hotel/fr/bastide-blanche-saintes-maries-de-la-mer.html?label=gen173nr-1FEgZzZWFyY2goggI46AdIM1gEaK0CiAEBmAExuAEYyAEV2AEB6AEB-AECiAIBqAIEuAK8j6yrBsACAdICJDFjNzg0MjIyLTZlODctNDg5Yi04ZGUxLTI0NTg1OTM0MTUwM9gCBeACAQ&sid=92f3b495119c1eee67254154eb729221&aid=304142&ucfs=1&arphpl=1&dest_id=-1465138&dest_type=city&group_adults=2&req_adults=2&no_rooms=1&group_children=0&req_children=0&hpos=8&hapos=8&sr_order=popularity&srpvid=68a64a1ee69b0161&srepoch=1701513151&from_sustainable_property_sr=1&from=searchresults,43.45334531,4.43066597
131,Saintes Maries de la mer,Thalacap Camargue,"  Avenue du Dr Cambon, 13460 Saintes-Maries-de-la-Mer, France ",Good,7.8,962 reviews,"['Indoor swimming pool', 'Free parking', 'Spa', 'Restaurant', 'Free WiFi', 'Family rooms', 'Fitness center', 'Tea/Coffee Maker in All Rooms', 'Bar', 'Excellent Breakfast', 'Indoor swimming pool', 'Free parking', 'Spa', 'Restaurant', 'Free WiFi', 'Family rooms', 'Fitness center', 'Tea/Coffee Maker in All Rooms', 'Bar', 'Excellent Breakfast', 'Toilet paper', 'Towels', 'Private Bathroom', 'Toilet', 'Free toiletries', 'Hairdryer', 'Bathtub', 'Linens', 'Wardrobe or closet', 'Garden view', 'Outdoor furniture', 'Sun deck', 'Terrace', 'Garden', 'Coffee machine', 'Electric kettle', 'Walking tours', 'Horseback riding', 'Cycling', 'Hiking', 'Canoeing', 'Fishing', 'Flat-screen TV', 'Satellite channels', 'Radio', 'Telephone', 'TV', 'Coffee house on site', 'Wine/Champagne', ""Kids' meals"", 'Special diet meals (on request)', 'Snack bar', 'Bar', 'Restaurant', 'Tea/Coffee maker', 'Parking garage', 'Accessible parking', 'Shuttle service', 'Baggage storage', 'Wake-up service', 'Hair/Beauty salon', 'Airport shuttle', '24-hour front desk', 'Meeting/Banquet facilities', 'Fire extinguishers', 'Smoke alarms', '24-hour security', 'Safe', 'Air conditioning', 'Mosquito net', 'Heating', 'Elevator', 'Family rooms', 'Non-smoking rooms', 'Upper floors accessible by elevator', 'Open all year', 'Heated pool', 'Saltwater pool', ""Kids' pool"", 'Fitness classes', 'Yoga classes', 'Fitness', 'Spa/Wellness packages', 'Spa lounge/Relaxation area', 'Spa facilities', 'Body wrap', 'Body scrub', 'Body treatments', 'Makeup services', 'Waxing services', 'Facial treatments', 'Beauty services', 'Beach umbrellas', 'Turkish/Steam Bath', 'Hot tub/Jacuzzi', 'Massage', 'Spa', 'Solarium', 'Fitness center', 'Sauna', 'English', 'French', 'Italian']","Thalacap Camargue faces the beach in Saintes-Maries-de-la-Mer, 5 minutes' walk from the city center. You will enjoy a seasonal outdoor seawater swimming pool as well as an indoor swimming pool, sauna and hammam all year round at no additional cost

All of the rooms at Thalacap Camargue have a flat-screen TV and free WiFi access and air conditioning.

The restaurant serves Mediterranean-style meals. Weather permitting, meals can be enjoyed on the terrace with a panoramic view of the sea.

In addition to the other relaxation facilities, guests have direct access to a Thalassotherapy center, which provides a number of health and beauty treatments for an additional charge.

Arles is 23 mi away. private parking is available on site for 10€/night.",https://www.booking.com/hotel/fr/thalacap-camargue.html?label=gen173nr-1FEgZzZWFyY2goggI46AdIM1gEaK0CiAEBmAExuAEYyAEV2AEB6AEB-AECiAIBqAIEuAK8j6yrBsACAdICJDFjNzg0MjIyLTZlODctNDg5Yi04ZGUxLTI0NTg1OTM0MTUwM9gCBeACAQ&sid=92f3b495119c1eee67254154eb729221&aid=304142&ucfs=1&arphpl=1&dest_id=-1465138&dest_type=city&group_adults=2&req_adults=2&no_rooms=1&group_children=0&req_children=0&hpos=7&hapos=7&sr_order=popularity&srpvid=68a64a1ee69b0161&srepoch=1701513151&from=searchresults,43.45349134,4.43545103
132,Saintes Maries de la mer,Mas de la Fouque - Hôtel & Spa," Route du Petit Rhône, 13460 Saintes-Maries-de-la-Mer, France ",Good,7.7,246 reviews,"['2 swimming pools', 'Free parking', 'Spa', 'Restaurant', 'Free WiFi', 'Family rooms', 'Fitness center', 'Tea/Coffee Maker in All Rooms', 'Bar', 'Wonderful Breakfast', '2 swimming pools', 'Free parking', 'Spa', 'Restaurant', 'Free WiFi', 'Family rooms', 'Fitness center', 'Tea/Coffee Maker in All Rooms', 'Bar', 'Wonderful Breakfast', 'Private Bathroom', 'Free toiletries', 'Hairdryer', 'Outdoor furniture', 'Sun deck', 'Terrace', 'Garden', 'Bicycle rental', 'Live music/Performance', 'Tour or class about local culture', 'Themed dinners', 'Bike tours', 'Walking tours', 'Temporary art galleries', 'Tennis equipment', 'Evening entertainment', 'Horseback riding', 'Hiking', 'Game room', 'Tennis court', 'Cable channels', 'Fruit', 'Wine/Champagne', ""Kids' meals"", 'Special diet meals (on request)', 'Snack bar', 'Breakfast in the room', 'Bar', 'Restaurant', 'Tea/Coffee maker', 'Accessible parking', 'Invoice provided', 'Private check-in/out', 'Concierge', 'Baggage storage', 'Tour desk', 'Express check-in/out', '24-hour front desk', 'Board games/Puzzles', 'Daily housekeeping', 'Ironing service', 'Laundry', 'Fax/Photocopying', 'Business center', 'Meeting/Banquet facilities', 'Fire extinguishers', 'Smoke alarms', 'Security alarm', 'Safe', 'Air conditioning', 'Smoke-free property', 'Heating', 'Packed lunches', 'Family rooms', 'Non-smoking rooms', 'Room service', 'Open all year', 'Adults only', 'Heated pool', 'Seasonal', 'All ages welcome', 'Beach chairs/Loungers', 'Locker rooms', 'Personal trainer', 'Fitness classes', 'Yoga classes', 'Fitness', 'Spa/Wellness packages', 'Foot bath', 'Spa lounge/Relaxation area', 'Spa facilities', 'Body wrap', 'Body scrub', 'Body treatments', 'Pedicure', 'Manicure', 'Makeup services', 'Waxing services', 'Facial treatments', 'Beauty services', 'Beach umbrellas', 'Beach chairs/Loungers', 'Open-air bath', 'Hot tub/Jacuzzi', 'Massage', 'Spa', 'Fitness center', 'Sauna', 'English', 'French']","Mas de la Fouque boutique-hotel is located at the heart of the Camargue Nature Reserve just 10 minutes' drive from Saintes-Maries-de-la-Mer and 1.2 mi from the beaches. It offers an outdoor swimming pool and an on-site bar.

Each air-conditioned room and suite is uniquely decorated. Some have a private terrace facing the lagoons or swimming pool.  They are equipped with satellite TV. Free WiFi internet access in available throughout the property.

Guests can view local wild life such as flamingos, Camargue horses and wild bulls while enjoying a drink on the outdoor lounges. The on-site Nuxe spa proposes a sauna, outdoor relaxing bath and an indoor pool

The restaurant serves organic, natural cuisine and guests can dine al fresco or by the fireplace in winter. A buffet breakfast is served daily.

Free private parking is available on site. Nimes Train Station is 40 minutes from Mas de la Fouque and Montpellier-Mediterranee Airport is 22 mi away.",https://www.booking.com/hotel/fr/lodge-de-la-fouque.html?label=gen173nr-1FEgZzZWFyY2goggI46AdIM1gEaK0CiAEBmAExuAEYyAEV2AEB6AEB-AECiAIBqAIEuAK8j6yrBsACAdICJDFjNzg0MjIyLTZlODctNDg5Yi04ZGUxLTI0NTg1OTM0MTUwM9gCBeACAQ&sid=92f3b495119c1eee67254154eb729221&aid=304142&ucfs=1&arphpl=1&dest_id=-1465138&dest_type=city&group_adults=2&req_adults=2&no_rooms=1&group_children=0&req_children=0&hpos=5&hapos=5&sr_order=popularity&srpvid=68a64a1ee69b0161&srepoch=1701513151&from_sustainable_property_sr=1&from=searchresults,43.4670806,4.40451175
133,Saintes Maries de la mer,Le Dauphin Bleu," 31 Avenue Gilbert Leroy, 13460 Saintes-Maries-de-la-Mer, France ",Very Good,8.4,"1,230 reviews","['2 restaurants', 'Free WiFi', 'Family rooms', 'Non-smoking rooms', 'Room service', 'Bar', 'Excellent Breakfast', '2 restaurants', 'Free WiFi', 'Family rooms', 'Non-smoking rooms', 'Room service', 'Bar', 'Excellent Breakfast', 'Toilet paper', 'Private Bathroom', 'Toilet', 'Free toiletries', 'Hairdryer', 'Alarm clock', 'Terrace', 'Refrigerator', 'Socket near the bed', 'Live music/Performance', 'Desk', 'Flat-screen TV', 'Satellite channels', 'Telephone', 'Wine/Champagne', ""Kids' meals"", 'Bar', 'Restaurant', 'Laundry', 'Room service', 'Safe', 'Air conditioning', 'Smoke-free property', 'Mosquito net', 'Tile/Marble floor', 'Heating', 'Family rooms', 'Non-smoking rooms', 'English', 'French', 'Italian', 'Russian']","Located 164 feet from the beach, Le Dauphin Bleu faces the Mediterranean Sea and is 1312 feet from the center of Saintes-Maries-de-la-Mer's historic old town. The hotel offers free WiFi in the guest rooms.

All rooms are air-conditioned and have a flat-screen TV, a private bathroom and some have sea views.

Located in the Rhône delta, this hotel is just 2297 feet from a fortified church dating from the Middle Ages. The local area also offers water sports such as windsurfing. Le Dauphin Bleu is 35 mi from Montpelier Airport.",https://www.booking.com/hotel/fr/le-dauphin-bleu.html?label=gen173nr-1FEgZzZWFyY2goggI46AdIM1gEaK0CiAEBmAExuAEYyAEV2AEB6AEB-AECiAIBqAIEuAK8j6yrBsACAdICJDFjNzg0MjIyLTZlODctNDg5Yi04ZGUxLTI0NTg1OTM0MTUwM9gCBeACAQ&sid=92f3b495119c1eee67254154eb729221&aid=304142&ucfs=1&arphpl=1&dest_id=-1465138&dest_type=city&group_adults=2&req_adults=2&no_rooms=1&group_children=0&req_children=0&hpos=6&hapos=6&sr_order=popularity&srpvid=68a64a1ee69b0161&srepoch=1701513151&from=searchresults,43.45233086,4.43364993
134,Saintes Maries de la mer,Hotel Le Bleu Marine," 15, Avenue du Docteur Cambon, 13460 Saintes-Maries-de-la-Mer, France ",Good,7.6,"1,274 reviews","['Outdoor swimming pool', 'Free WiFi', 'Family rooms', 'Facilities for disabled guests', 'Non-smoking rooms', 'Bar', 'Good Breakfast', 'Outdoor swimming pool', 'Free WiFi', 'Family rooms', 'Facilities for disabled guests', 'Non-smoking rooms', 'Bar', 'Good Breakfast', 'Toilet paper', 'Towels', 'Bathtub or shower', 'Private Bathroom', 'Toilet', 'Free toiletries', 'Wardrobe or closet', 'Terrace', 'Bar crawls', 'Desk', 'Flat-screen TV', 'Coffee house on site', 'Wine/Champagne', 'Snack bar', 'Breakfast in the room', 'Bar', 'CCTV in common areas', 'Smoke alarms', 'Security alarm', '24-hour security', 'Air conditioning', 'Heating', 'Family rooms', 'Facilities for disabled guests', 'Non-smoking rooms', 'Open all year', 'Beach umbrellas', 'Beach chairs/Loungers', 'English', 'French']","Bleu Marine is just 492 feet from Mediterranean beaches and 984 feet from the center of Saintes-Maries-de-la-Mer village. It features a fenced, outdoor swimming pool with sun loungers and free Wi-Fi.

Several rooms at Hotel Le Bleu Marine have a balcony with pool view. Each room is equipped with a flat-screen TV and a private bathroom.

The buffet breakfast is served every morning. Many shops and restaurants are less than 10 minutes’ walk from the hotel. Hot and cold drinks are available upon request.

There is a thalassotherapy center just 328 feet from the hotel's door.

Hotel Le Bleu Marine is 25 mi from Arles and 37 mi from Montpellier. Free parking is available on site.",https://www.booking.com/hotel/fr/le-bleu-marine.html?label=gen173nr-1FEgZzZWFyY2goggI46AdIM1gEaK0CiAEBmAExuAEYyAEV2AEB6AEB-AECiAIBqAIEuAK8j6yrBsACAdICJDFjNzg0MjIyLTZlODctNDg5Yi04ZGUxLTI0NTg1OTM0MTUwM9gCBeACAQ&sid=92f3b495119c1eee67254154eb729221&aid=304142&ucfs=1&arphpl=1&dest_id=-1465138&dest_type=city&group_adults=2&req_adults=2&no_rooms=1&group_children=0&req_children=0&hpos=3&hapos=3&sr_order=popularity&srpvid=68a64a1ee69b0161&srepoch=1701513151&from=searchresults,43.45463818,4.433202
