,city,hotel_name,hotel_address,hotel_general_review,hotel_rating,numbers_of_reviews,hotel_facilities,hotel_description,url_booking_hotel,lat_hotel,lon_hotel
65,La Rochelle,Hôtel Saint Nicolas," 13 rue Sardinerie, 17000 La Rochelle, France ",Excellent,8.6,"1,993 reviews","['Private Parking', 'Family rooms', 'Free WiFi', 'Fitness center', 'Non-smoking rooms', 'Facilities for disabled guests', 'Room service', 'Tea/Coffee Maker in All Rooms', 'Bar', 'Very Good Breakfast', 'Private Parking', 'Family rooms', 'Free WiFi', 'Fitness center', 'Non-smoking rooms', 'Facilities for disabled guests', 'Room service', 'Tea/Coffee Maker in All Rooms', 'Bar', 'Very Good Breakfast', 'Toilet paper', 'Towels', 'Private Bathroom', 'Toilet', 'Free toiletries', 'Hairdryer', 'Shower', 'Linens', 'Wardrobe or closet', 'Outdoor furniture', 'Sun deck', 'Terrace', 'Coffee machine', 'Electric kettle', 'Socket near the bed', 'Clothes rack', 'Bicycle rental', 'Bike tours', 'Walking tours', 'Desk', 'Flat-screen TV', 'Cable channels', 'Satellite channels', 'Radio', 'Telephone', 'TV', 'Coffee house on site', 'Wine/Champagne', 'Snack bar', 'Breakfast in the room', 'Bar', 'Tea/Coffee maker', 'Parking garage', 'Electric vehicle charging station', 'Accessible parking', 'Invoice provided', 'Concierge', 'Baggage storage', '24-hour front desk', 'Babysitting/Child services', 'Daily housekeeping', 'Ironing service', 'Dry cleaning', 'Fax/Photocopying', 'Meeting/Banquet facilities', 'Fire extinguishers', 'CCTV in common areas', 'Smoke alarms', 'Security alarm', 'Key card access', '24-hour security', 'Safe', 'Grocery deliveries', 'Air conditioning', 'Smoke-free property', 'Wake-up service', 'Heating', 'Packed lunches', 'Carpeted', 'Elevator', 'Family rooms', 'Facilities for disabled guests', 'Non-smoking rooms', 'Wake-up service/Alarm clock', 'Room service', 'Raised toilet', 'Toilet with grab rails', 'Wheelchair accessible', 'Upper floors accessible by elevator', 'Fitness', 'Fitness center', 'English', 'Spanish', 'French']","Located in the lively Saint Nicolas district in La Rochelle, this hotel is surrounded by antique dealers, bars and cafés. It offers free Wi-Fi and a conservatory with large sofas and tropical plants.

The air-conditioned guest rooms each have a flat-screen TV with canal+ and satellite channels. Private bathrooms are equipped with a shower or a bathroom and hairdryer.

A buffet breakfast featuring hot and fresh items is served daily in the conservatory. A continental breakfast can also be delivered directly to guests’ rooms. Local drinks, tea and coffee can be enjoyed in the bar.

Limited private secured parking can be booked at an extra cost, upon availability. The maximum height is 1m90 and the width of the parking spaces is about 6.6 ft.

Saint Nicolas Tower that guards the entrance to the old port is 1804 feet from the hotel. La Rochelle Train Station is 2297 feet away.",https://www.booking.com/hotel/fr/comforthotelsaintnicolas.html?label=gen173nr-1FEgZzZWFyY2goggI46AdIM1gEaK0CiAEBmAExuAEYyAEV2AEB6AEB-AECiAIBqAIEuAK9j6yrBsACAdICJGFkNjgzZGZmLWM3Y2UtNDhmNS1hYWI4LTliMTkxMmQ3MDlmMdgCBeACAQ&sid=9ff3c77c3e69683a4b888a8270f19d86&aid=304142&ucfs=1&arphpl=1&dest_id=-1438604&dest_type=city&group_adults=2&req_adults=2&no_rooms=1&group_children=0&req_children=0&hpos=1&hapos=1&sr_order=popularity&srpvid=b2304a1f2e2b0157&srepoch=1701513152&from_sustainable_property_sr=1&from=searchresults,46.15813457,-1.14891277
66,Bormes les Mimosas,Appartement unique dans le domaine de la sangliere," 3886 Route de Léoube, 83230 Bormes-les-Mimosas, France ",Wonderful,9.2,6 reviews,"['Free parking', 'Free WiFi', 'Free parking', 'Free WiFi', 'Kitchen', 'Washing machine', 'Dishwasher', 'Microwave', 'Flat-screen TV', 'Heating', 'Terrace', 'Tea/Coffee maker', 'Garden view', 'View', 'Air conditioning', 'Smoke-free property', 'English', 'French']","Appartement unique dans le domaine de la sangliere is located in Bormes-les-Mimosas, just 20 miles from Toulon Train Station and 21 miles from Zénith Oméga Toulon. This property offers access to a terrace and free private parking. Chateau de Grimaud is 25 miles from the apartment and Le Pont des Fées is 25 miles away.

With free Wifi, this 1-bedroom apartment features a flat-screen TV, a washing machine, and a fully equipped kitchen with a dishwasher and microwave. The accommodation is non-smoking.

Popular points of interest near the apartment include Plage du Pellegrin, Chapelle Saint-Georges Beach, and Plage de l'Argentiere. The nearest airport is Toulon - Hyeres Airport, 9.3 miles from Appartement unique dans le domaine de la sangliere.",https://www.booking.com/hotel/fr/appartement-unique-dans-un-domaine-viticole.html?label=gen173nr-1FEgZzZWFyY2goggI46AdIM1gEaK0CiAEBmAExuAEYyAEV2AEB6AEB-AECiAIBqAIEuAK8j6yrBsACAdICJGI3Y2NkYzRmLWRmOTktNDUxOS1hOWU0LTdhM2Q2NDg1ZWJjZtgCBeACAQ&sid=814993194482387224769589976bd349&aid=304142&ucfs=1&arphpl=1&dest_id=-1413801&dest_type=city&group_adults=2&req_adults=2&no_rooms=1&group_children=0&req_children=0&hpos=23&hapos=23&sr_order=popularity&srpvid=7ed94a1e4082015a&srepoch=1701513151&from=searchresults,43.1279047,6.2772223
67,Bormes les Mimosas,Le petit atelier," 34 Chemin de la Bergerie, 83230 Bormes-les-Mimosas, France ",Wonderful,9.0,115 reviews,"['Free parking', 'Fast free Wifi 292 Mbps)', 'Non-smoking rooms', 'Breakfast', 'Free parking', 'Fast free Wifi 292 Mbps)', 'Non-smoking rooms', 'Breakfast', 'Accessible parking', 'Dining table', 'Coffee machine', 'Cleaning products', 'Toaster', 'Stovetop', 'Oven', 'Kitchenware', 'Electric kettle', 'Kitchen', 'Washing machine', 'Microwave', 'Refrigerator', 'Linens', 'Wardrobe or closet', 'Extra long beds (> 6.5 ft)', 'Toilet paper', 'Towels', 'Bathtub or shower', 'Private Bathroom', 'Toilet', 'Hairdryer', 'Shower', 'Dining area', 'Sofa', 'Sitting area', 'Flat-screen TV', 'TV', 'Socket near the bed', 'Drying rack for clothing', 'Clothes rack', 'Tile/Marble floor', 'Private entrance', 'Hot tub', 'Entire unit located on ground floor', 'Outdoor furniture', 'Outdoor dining area', 'Sun deck', 'Barbecue', 'BBQ facilities', 'Terrace', 'Garden', 'Full-body massage', 'Hand massage', 'Head massage', 'Neck massage', 'Back massage', 'Beauty services', 'Beach umbrellas', 'Beach chairs/Loungers', 'Hot tub/Jacuzzi', 'Massage', 'Tea/Coffee maker', 'Tour or class about local culture', 'Horseback riding', 'Diving', 'Hiking', 'Windsurfing', 'Ping-pong', 'Pool table', 'Fishing', 'Inner courtyard view', 'Garden view', 'Detached', 'Invoice provided', 'Board games/Puzzles', 'Board games/puzzles', 'Designated smoking area', 'Air conditioning', 'Smoke-free property', 'Heating', 'Non-smoking rooms', 'Smoke alarms', 'Key access', 'French']","Le petit atelier is a sustainable vacation home in Bormes-les-Mimosas where guests can make the most of its garden and barbecue facilities. There's a private entrance at the vacation home for the convenience of those who stay. The vacation home features rooms with air conditioning, free private parking, and free Wifi.

The vacation home provides guests with a terrace, garden views, a seating area, a flat-screen TV, a fully equipped kitchen with an oven and a microwave, and a private bathroom with hot tub and a hair dryer. A toaster, a fridge, and stovetop are also available, as well as a coffee machine and a kettle. At the vacation home, every unit is equipped with bed linen and towels.

You can play billiards and table tennis at Le petit atelier.

Plage de l'Anglade is 1.7 miles from the accommodation, while Pointe de Gouron Beach is 1.8 miles from the property. The nearest airport is Toulon - Hyeres Airport, 12 miles from Le petit atelier.",https://www.booking.com/hotel/fr/le-petit-atelier-bormes-les-mimosas1234567891011121314151617.html?label=gen173nr-1FEgZzZWFyY2goggI46AdIM1gEaK0CiAEBmAExuAEYyAEV2AEB6AEB-AECiAIBqAIEuAK8j6yrBsACAdICJGI3Y2NkYzRmLWRmOTktNDUxOS1hOWU0LTdhM2Q2NDg1ZWJjZtgCBeACAQ&sid=814993194482387224769589976bd349&aid=304142&ucfs=1&arphpl=1&dest_id=-1413801&dest_type=city&group_adults=2&req_adults=2&no_rooms=1&group_children=0&req_children=0&hpos=21&hapos=21&sr_order=popularity&srpvid=7ed94a1e4082015a&srepoch=1701513151&from_sustainable_property_sr=1&from=searchresults,43.142501,6.3491788
68,Bormes les Mimosas,Coeur de village," 2 Rue Gabriel Peri, 83230 Bormes-les-Mimosas, France ",Very Good,8.5,12 reviews,"['Free parking', 'Non-smoking rooms', 'Free parking', 'Non-smoking rooms', 'Toilet paper', 'Towels', 'Towels/Sheets (extra fee)', 'Bathtub or shower', 'Private Bathroom', 'Toilet', 'Free toiletries', 'Shower', 'Linens', 'Wardrobe or closet', 'City view', 'View', 'Picnic area', 'Outdoor furniture', 'Terrace', 'Dining table', 'Coffee machine', 'Cleaning products', 'Stovetop', 'Kitchenware', 'Electric kettle', 'Kitchen', 'Microwave', 'Refrigerator', 'Socket near the bed', 'Live music/Performance', 'Tour or class about local culture', 'Walking tours', 'Beach', 'Mini golf', 'Snorkeling', 'Diving', 'Hiking', 'Canoeing', 'Fishing', 'Tennis court', 'Dining area', 'Sitting area', 'Coffee house on site', 'Wine/Champagne', 'Tea/Coffee maker', 'Street parking', 'Shuttle service', 'Outdoor play equipment for kids', 'Board games/Puzzles', 'Board games/puzzles', 'Fire extinguishers', 'CCTV outside property', 'Smoke alarms', 'Key access', 'Smoke-free property', 'Tile/Marble floor', 'Heating', 'Private entrance', 'Chapel/Shrine', 'Non-smoking rooms', 'Entire unit located on ground floor', 'English', 'French']","Coeur de village offers accommodations in Bormes-les-Mimosas, 18 miles from Chateau de Grimaud and 18 miles from Le Pont des Fées. With city views, this accommodation offers a terrace. Parking on-site is available, and the bed and breakfast also provides a shuttle service for guests who want to explore the surrounding area.

There is a seating area, a dining area, and a kitchen complete with a microwave, a fridge, and a stovetop. For added privacy, the accommodation features a private entrance.

There is an on-site coffee shop.

Guests at the bed and breakfast will be able to enjoy activities in and around Bormes-les-Mimosas, like snorkeling, hiking, and walking tours. Outdoor play equipment is also available for guests at Coeur de village.

Toulon Train Station is 24 miles from the accommodation, while Zénith Oméga Toulon is 24 miles away. The nearest airport is Toulon - Hyeres Airport, 13 miles from Coeur de village.",https://www.booking.com/hotel/fr/coeur-de-village-bormes-les-mimosas.html?label=gen173nr-1FEgZzZWFyY2goggI46AdIM1gEaK0CiAEBmAExuAEYyAEV2AEB6AEB-AECiAIBqAIEuAK8j6yrBsACAdICJGI3Y2NkYzRmLWRmOTktNDUxOS1hOWU0LTdhM2Q2NDg1ZWJjZtgCBeACAQ&sid=814993194482387224769589976bd349&aid=304142&ucfs=1&arphpl=1&dest_id=-1413801&dest_type=city&group_adults=2&req_adults=2&no_rooms=1&group_children=0&req_children=0&hpos=20&hapos=20&sr_order=popularity&srpvid=7ed94a1e4082015a&srepoch=1701513151&from=searchresults,43.150077,6.342641
69,Bormes les Mimosas,Holiday Home Maison Boutons d'Or by Interhome," 83230 Bormes-les-Mimosas, France ",Exceptional,10.0,1 review,"['Outdoor swimming pool', 'Free parking', 'Free WiFi', 'Non-smoking rooms', 'Outdoor swimming pool', 'Free parking', 'Free WiFi', 'Non-smoking rooms', 'Dining table', 'Coffee machine', 'Oven', 'Kitchenware', 'Kitchen', 'Washing machine', 'Dishwasher', 'Microwave', 'Refrigerator', 'Private Bathroom', 'Toilet', 'Hairdryer', 'Shower', 'Dining area', 'Sitting area', 'TV', 'Private entrance', 'Heating', 'Ironing facilities', 'Upper floors accessible by stairs only', 'Terrace', 'Private pool', 'Balcony', 'Seasonal', 'Horseback riding', 'Hiking', 'Canoeing', 'Semi-detached', 'Air conditioning', 'Smoke-free property', 'Non-smoking rooms']","Holiday Home Maison Boutons d'Or by Interhome is a sustainable vacation home in Bormes-les-Mimosas, 20 miles from Chateau de Grimaud. This property encourages guests to embrace nature with its eco-friendly arrangements. This property offers access to a terrace, free private parking, and free Wifi. Le Pont des Fées is 20 miles from the vacation home and Toulon Train Station is 24 miles away.

The vacation home features 3 bedrooms, a fully equipped kitchen with a dishwasher and an oven, a washing machine, and 2 bathrooms with a hair dryer. A TV is featured. For added privacy, the accommodation features a private entrance.

Zénith Oméga Toulon is 24 miles from Holiday Home Maison Boutons d'Or by Interhome, while La Favière is 1.9 miles away. The nearest airport is Toulon - Hyeres Airport, 12 miles from the accommodation.",https://www.booking.com/hotel/fr/holiday-home-maison-boutons-d-or.html?label=gen173nr-1FEgZzZWFyY2goggI46AdIM1gEaK0CiAEBmAExuAEYyAEV2AEB6AEB-AECiAIBqAIEuAK8j6yrBsACAdICJGI3Y2NkYzRmLWRmOTktNDUxOS1hOWU0LTdhM2Q2NDg1ZWJjZtgCBeACAQ&sid=814993194482387224769589976bd349&aid=304142&ucfs=1&arphpl=1&dest_id=-1413801&dest_type=city&group_adults=2&req_adults=2&no_rooms=1&group_children=0&req_children=0&hpos=22&hapos=22&sr_order=popularity&srpvid=7ed94a1e4082015a&srepoch=1701513151&from_sustainable_property_sr=1&from=searchresults,43.139768,6.341987
70,Bormes les Mimosas,Les deux mas," les deux mas 59 Rue des Hortensias, 83230 Bormes-les-Mimosas, France ",Wonderful,9.3,84 reviews,"['Outdoor swimming pool', 'Free parking', 'Free WiFi', 'Non-smoking rooms', 'Outdoor swimming pool', 'Free parking', 'Free WiFi', 'Non-smoking rooms', 'Parking garage', 'High chair', 'Dining table', 'Coffee machine', 'Cleaning products', 'Toaster', 'Stovetop', 'Kitchenware', 'Electric kettle', 'Washing machine', 'Dishwasher', 'Microwave', 'Refrigerator', 'Linens', 'Wardrobe or closet', 'Extra long beds (> 6.5 ft)', 'Toilet paper', 'Towels', 'Private Bathroom', 'Toilet', 'Hairdryer', 'Shower', 'Sofa', 'Sitting area', 'Desk', 'Blu-ray player', 'Flat-screen TV', 'Video', 'CD player', 'DVD player', 'TV', 'Socket near the bed', 'Drying rack for clothing', 'Clothes rack', 'Tile/Marble floor', 'Private entrance', 'Ironing facilities', 'Iron', 'Entire unit located on ground floor', 'Outdoor dining area', 'Outdoor furniture', 'Barbecue', 'Private pool', 'BBQ facilities', 'Terrace', 'Garden', 'Open all year', 'All ages welcome', 'Beach chairs/Loungers', 'Beach umbrellas', 'Beach chairs/Loungers', 'Garden view', 'View', 'Detached', 'Books, DVDs or music for children', 'Air conditioning', 'Smoke-free property', 'Heating', 'Non-smoking rooms', 'Smoke alarms', 'English', 'Spanish', 'French']","Providing garden views, Les deux mas in Bormes-les-Mimosas offers accommodations, a garden, and barbecue facilities. With pool views, this accommodation features a terrace and a swimming pool. The vacation home provides rooms with air conditioning, free private parking, and free Wifi.

At the vacation home, all units are fitted with a desk, a flat-screen TV, a private bathroom, bed linen, and towels. A dishwasher, a microwave, and toaster are also provided, as well as a coffee machine and a kettle. At the vacation home, units come with a seating area.

Chateau de Grimaud is 19 miles from the vacation home, while Le Pont des Fées is 19 miles away. The nearest airport is Toulon - Hyeres Airport, 12 miles from Les deux mas.",https://www.booking.com/hotel/fr/lou-mazet-bormes-les-mimosas.html?label=gen173nr-1FEgZzZWFyY2goggI46AdIM1gEaK0CiAEBmAExuAEYyAEV2AEB6AEB-AECiAIBqAIEuAK8j6yrBsACAdICJGI3Y2NkYzRmLWRmOTktNDUxOS1hOWU0LTdhM2Q2NDg1ZWJjZtgCBeACAQ&sid=814993194482387224769589976bd349&aid=304142&ucfs=1&arphpl=1&dest_id=-1413801&dest_type=city&group_adults=2&req_adults=2&no_rooms=1&group_children=0&req_children=0&hpos=18&hapos=18&sr_order=popularity&srpvid=7ed94a1e4082015a&srepoch=1701513151&from=searchresults,43.14393659,6.33632324
71,Bormes les Mimosas,Superbe T4 -Vue Mer- Tout Confort Refait à Neuf!," 10 Rue des Lentisques, 83230 Bormes-les-Mimosas, France ",Exceptional,9.6,22 reviews,"['Free parking', 'Free WiFi', 'Family rooms', 'Non-smoking rooms', 'Free parking', 'Free WiFi', 'Family rooms', 'Non-smoking rooms', 'Dining table', 'Coffee machine', 'Toaster', 'Stovetop', 'Oven', 'Dryer', 'Kitchenware', 'Electric kettle', 'Kitchen', 'Washing machine', 'Dishwasher', 'Microwave', 'Refrigerator', 'Linens', 'Toilet paper', 'Towels', 'Private Bathroom', 'Hairdryer', 'Shower', 'Sofa', 'Sitting area', 'iPod dock', 'Flat-screen TV', 'Satellite channels', 'TV', 'Socket near the bed', 'Sofa bed', 'Drying rack for clothing', 'Tile/Marble floor', 'Private entrance', 'Heating', 'Ironing facilities', 'Iron', 'Outdoor dining area', 'Outdoor furniture', 'Barbecue', 'BBQ facilities', 'Terrace', 'Garden', 'Tea/Coffee maker', 'Beach', 'Hiking', 'Windsurfing', 'Tennis court', 'City view', 'Garden view', 'Ocean view', 'View', 'Private apartment in building', 'Air conditioning', 'Smoke-free property', 'Family rooms', 'Non-smoking rooms', 'English', 'Spanish', 'French']","Superbe T4 -Vue Mer- Tout Confort Refait à Neuf! is a recently renovated apartment in Bormes-les-Mimosas where guests can make the most of the garden and tennis court. The air-conditioned accommodation is 1.8 miles from Grande Plage, and guests can benefit from complimentary Wifi and private parking available on site. Toulon Train Station is 25 miles from the apartment and Zénith Oméga Toulon is 25 miles away.

Offering a terrace and sea views, the spacious apartment includes 3 bedrooms, a living room, satellite flat-screen TV, an equipped kitchen, and 1 bathroom with a walk-in shower. Towels and bed linen are offered in the apartment. The property has an outdoor dining area.

Guests can make the most of the warm weather with the property's barbecue facilities.

Guests at the apartment will be able to enjoy activities in and around Bormes-les-Mimosas, like windsurfing and hiking.

Chateau de Grimaud is 19 miles from Superbe T4 -Vue Mer- Tout Confort Refait à Neuf!, while Le Pont des Fées is 19 miles from the property. The nearest airport is Toulon - Hyeres Airport, 14 miles from the accommodation.",https://www.booking.com/hotel/fr/superbe-t4-vue-mer-tout-confort-refait-a-neuf.html?label=gen173nr-1FEgZzZWFyY2goggI46AdIM1gEaK0CiAEBmAExuAEYyAEV2AEB6AEB-AECiAIBqAIEuAK8j6yrBsACAdICJGI3Y2NkYzRmLWRmOTktNDUxOS1hOWU0LTdhM2Q2NDg1ZWJjZtgCBeACAQ&sid=814993194482387224769589976bd349&aid=304142&ucfs=1&arphpl=1&dest_id=-1413801&dest_type=city&group_adults=2&req_adults=2&no_rooms=1&group_children=0&req_children=0&hpos=17&hapos=17&sr_order=popularity&srpvid=7ed94a1e4082015a&srepoch=1701513151&from=searchresults,43.1448805,6.35332445
72,Bormes les Mimosas,Maison au village de Bormes Les Mimosas," 11 Rue de la Plaine des Ânes, 83230 Bormes-les-Mimosas, France ",Excellent,8.9,14 reviews,"['Non-smoking rooms', 'Non-smoking rooms', 'Dining table', 'Coffee machine', 'Stovetop', 'Dryer', 'Kitchenware', 'Electric kettle', 'Kitchen', 'Washing machine', 'Microwave', 'Refrigerator', 'Linens', 'Wardrobe or closet', 'Toilet paper', 'Bathtub or shower', 'Private Bathroom', 'Toilet', 'Sofa', 'Sitting area', 'Flat-screen TV', 'TV', 'Socket near the bed', 'Private entrance', 'Heating', 'Fan', 'Upper floors accessible by stairs only', 'Tea/Coffee maker', 'Detached', 'Board games/puzzles', 'Smoke-free property', 'Non-smoking rooms', 'Smoke alarms', 'English', 'French']","Maison au village de Bormes Les Mimosas is located in Bormes-les-Mimosas, just 24 miles from Zénith Oméga Toulon and 3 miles from La Favière. The property is around 18 miles from Chateau de Grimaud, 18 miles from Le Pont des Fées, and 24 miles from Toulon Train Station. Port Grimaud is 19 miles from the apartment.

The apartment consists of 2 bedrooms, a living room, a fully equipped kitchen with a microwave and a coffee machine, and 1 bathroom with an a bath or shower. A flat-screen TV is available. For added privacy, the accommodation features a private entrance.

Villa Noailles Art Centre is 13 miles from the apartment, while Penitents Chapel is 18 miles from the property. The nearest airport is Toulon - Hyeres Airport, 13 miles from Maison au village de Bormes Les Mimosas.",https://www.booking.com/hotel/fr/maison-au-village-de-bormes-les-mimosas.html?label=gen173nr-1FEgZzZWFyY2goggI46AdIM1gEaK0CiAEBmAExuAEYyAEV2AEB6AEB-AECiAIBqAIEuAK8j6yrBsACAdICJGI3Y2NkYzRmLWRmOTktNDUxOS1hOWU0LTdhM2Q2NDg1ZWJjZtgCBeACAQ&sid=814993194482387224769589976bd349&aid=304142&ucfs=1&arphpl=1&dest_id=-1413801&dest_type=city&group_adults=2&req_adults=2&no_rooms=1&group_children=0&req_children=0&hpos=16&hapos=16&sr_order=popularity&srpvid=7ed94a1e4082015a&srepoch=1701513151&from=searchresults,43.1503618,6.3421146
73,Bormes les Mimosas,Hotel Restaurant Bellevue," 14 place Gambetta, 83230 Bormes-les-Mimosas, France ",Good,7.5,587 reviews,"['Free parking', 'Free WiFi', 'Restaurant', 'Non-smoking rooms', 'Room service', 'Tea/Coffee Maker in All Rooms', 'Bar', 'Very Good Breakfast', 'Free parking', 'Free WiFi', 'Restaurant', 'Non-smoking rooms', 'Room service', 'Tea/Coffee Maker in All Rooms', 'Bar', 'Very Good Breakfast', 'Toilet paper', 'Towels', 'Private Bathroom', 'Toilet', 'Free toiletries', 'Hairdryer', 'Wardrobe or closet', 'Outdoor furniture', 'Sun deck', 'Terrace', 'Electric kettle', 'Socket near the bed', 'Flat-screen TV', 'Cable channels', 'Satellite channels', 'Telephone', 'TV', 'Coffee house on site', 'Fruit', 'Wine/Champagne', ""Kids' meals"", 'Snack bar', 'Breakfast in the room', 'Bar', 'Restaurant', 'Tea/Coffee maker', 'Pet bowls', 'Daily housekeeping', 'Concierge', 'Baggage storage', '24-hour front desk', 'Room service', 'Invoice provided', 'Fire extinguishers', 'CCTV in common areas', 'Smoke alarms', 'Security alarm', '24-hour security', 'Safe', 'Air conditioning', 'Smoke-free property', 'Soundproof', 'Carpeted', 'Heating', 'Non-smoking rooms', 'French']","Located in downtown Bormes-les-Mimosas, Hotel Restaurant Bellevue features a restaurant serving fresh and local products, a bar and a sitting area in front of the property. Rooms for disabled guests are available.

All rooms are nonsmoking, air-conditioned and equipped with a flat-screen TV, a safety deposit box and free Wi-Fi access. The private bathroom is complete with shower, toilet and hairdryer.

A breakfast buffet, including traditional pastries, fruits, eggs and juices, is served every morning at an additional cost. Guests can also enjoy the on-site restaurant and bar.

Hotel Restaurant Bellevue is 656 feet from Dom Forest, 2.5 mi from the beach and 22 mi from Saint-Tropez. Toulon Airport and Hyères Train Station are 14 mi away.",https://www.booking.com/hotel/fr/restaurant-bellevue.html?label=gen173nr-1FEgZzZWFyY2goggI46AdIM1gEaK0CiAEBmAExuAEYyAEV2AEB6AEB-AECiAIBqAIEuAK8j6yrBsACAdICJGI3Y2NkYzRmLWRmOTktNDUxOS1hOWU0LTdhM2Q2NDg1ZWJjZtgCBeACAQ&sid=814993194482387224769589976bd349&aid=304142&ucfs=1&arphpl=1&dest_id=-1413801&dest_type=city&group_adults=2&req_adults=2&no_rooms=1&group_children=0&req_children=0&hpos=19&hapos=19&sr_order=popularity&srpvid=7ed94a1e4082015a&srepoch=1701513151&from=searchresults,43.15187759,6.34313598
