,city,hotel_name,hotel_address,hotel_general_review,hotel_rating,numbers_of_reviews,hotel_facilities,hotel_description,url_booking_hotel,lat_hotel,lon_hotel
182,Aigues Mortes,Résidence Odalys Le Mas des Flamants," 60 Chemin de Trouche, 30220 Aigues-Mortes, France ",Very Good,8.1,435 reviews,"['Outdoor swimming pool', 'Free parking', 'WiFi', 'Family rooms', 'Non-smoking rooms', 'Facilities for disabled guests', 'Outdoor swimming pool', 'Free parking', 'WiFi', 'Family rooms', 'Non-smoking rooms', 'Facilities for disabled guests', 'Dining table', 'Stovetop', 'Kitchenware', 'Dishwasher', 'Microwave', 'Refrigerator', 'Kitchenette', 'Linens', 'Towels/Sheets (extra fee)', 'Bathtub or shower', 'Private Bathroom', 'Toilet', 'Dining area', 'Sitting area', 'Flat-screen TV', 'Sofa bed', 'Soundproof', 'Heating', 'Terrace', 'Seasonal', 'Solarium', 'Bicycle rental', 'Invoice provided', 'Laundry', 'Family rooms', 'Facilities for disabled guests', 'Non-smoking rooms', 'English', 'Spanish', 'French']","Located outside Aigues-Mortes’ fortifications, Résidence Odalys Le Mas des Flamants is just next to the Vidourle River. You can relax in the swimming and paddling pools or go to the beach at Le-Grau-du-Roi, 4.3 mi away.

Set in small and terraced houses, the apartments at Résidence Odalys Le Mas des Flamants offer a private patio or garden. A TV and Wi-Fi access are also available with an extra cost.

Meals can be prepared in the accommodations’s kitchenette and enjoyed in the small dining area. Each kitchenette includes hotplates, a microwave and a dishwasher.

One free parking space is offered per apartment and an on-site launderette is also at your disposal. Local activities include walking the 5 minutes to the town center or relaxing on Port-Camargue Beach, 4.3 mi away.",https://www.booking.com/hotel/fr/residence-le-mas-des-flamants.html?label=gen173nr-1FEgZzZWFyY2goggI46AdIM1gEaK0CiAEBmAExuAEYyAEV2AEB6AEB-AECiAIBqAIEuAK8j6yrBsACAdICJDM5N2U3NDhjLWM4MDAtNDhhYy1hY2U5LTQ2ZjU5ZGRhZWI0ONgCBeACAQ&sid=ff451afaa2ea1eac7df80483f821733d&aid=304142&ucfs=1&arphpl=1&dest_id=-1406800&dest_type=city&group_adults=2&req_adults=2&no_rooms=1&group_children=0&req_children=0&hpos=4&hapos=4&sr_order=popularity&srpvid=287e4a1eeef30052&srepoch=1701513150&from_sustainable_property_sr=1&from=searchresults,43.57379435,4.18062186
183,Aigues Mortes,le dit vin secret," 13 rue sadi carnot 13 rue sadi carnot, 30220 Aigues-Mortes, France ",Excellent,8.6,569 reviews,"['Free WiFi', 'Non-smoking rooms', 'Excellent Breakfast', 'Free WiFi', 'Non-smoking rooms', 'Excellent Breakfast', 'Private Bathroom', 'Outdoor furniture', 'Bicycle rental', 'Themed dinners', 'Bike tours', 'Temporary art galleries', 'Wine/Champagne', 'Daily housekeeping', 'Lockers', 'Ironing service', 'Fire extinguishers', 'Smoke alarms', 'Key access', '24-hour security', 'Designated smoking area', 'Air conditioning', 'Smoke-free property', 'Heating', 'Soundproof rooms', 'Non-smoking rooms', 'French']","Providing free bikes, le dit vin secret provides accommodations in Aigues-Mortes. Among the facilities of this property are a restaurant, full-day security, and daily room service, along with free Wifi. Montpellier Arena is 15 miles from the bed and breakfast, and Parc des Expositions de Montpellier is 15 miles away.

Some accommodations include a flat-screen TV, as well as air conditioning and an outdoor dining area. At the bed and breakfast, all units are equipped with a private bathroom.

A selection of options including local specialities, fresh pastries, and juice are served for the continental breakfast.

Zenith Sud Montpellier is 17 miles from the bed and breakfast, while Odysseum Shopping Center is 18 miles away. The nearest airport is Montpellier - Mediterranee Airport, 18 miles from le dit vin secret.",https://www.booking.com/hotel/fr/le-dit-vin-secret.html?label=gen173nr-1FEgZzZWFyY2goggI46AdIM1gEaK0CiAEBmAExuAEYyAEV2AEB6AEB-AECiAIBqAIEuAK8j6yrBsACAdICJDM5N2U3NDhjLWM4MDAtNDhhYy1hY2U5LTQ2ZjU5ZGRhZWI0ONgCBeACAQ&sid=ff451afaa2ea1eac7df80483f821733d&aid=304142&ucfs=1&arphpl=1&dest_id=-1406800&dest_type=city&group_adults=2&req_adults=2&no_rooms=1&group_children=0&req_children=0&hpos=2&hapos=2&sr_order=popularity&srpvid=287e4a1eeef30052&srepoch=1701513150&from=searchresults,43.566769,4.189113
184,Bayonne,Spacieux Cosy HyperCentre," 4 Rue des Tonneliers, 64100 Bayonne, France ",Wonderful,,74 external reviews,"['Free WiFi', 'Family rooms', 'Non-smoking rooms', 'Free WiFi', 'Family rooms', 'Non-smoking rooms', 'Dining table', 'Coffee machine', 'Toaster', 'Stovetop', 'Oven', 'Dryer', 'Kitchenware', 'Electric kettle', 'Kitchen', 'Washing machine', 'Dishwasher', 'Microwave', 'Refrigerator', 'Linens', 'Wardrobe or closet', 'Walk-in closet', 'Towels', 'Guest bathroom', 'Private Bathroom', 'Toilet', 'Hairdryer', 'Shower', 'Sofa', 'Sitting area', 'Desk', 'Flat-screen TV', 'TV', 'Drying rack for clothing', 'Heating', 'Ironing facilities', 'Iron', 'Tea/Coffee maker', 'Bar crawls', 'Temporary art galleries', 'Beach', 'Board games/Puzzles', 'Smoke-free property', 'Family rooms', 'Non-smoking rooms', 'English', 'French']","Spacieux Cosy HyperCentre is located in Bayonne, just 14 miles from Saint Jean de Luz Train Station and 14 miles from Saint Jean Baptiste Church. The property is around 22 miles from Hendaye Train Station, 22 miles from FICOBA, and 30 miles from Pasaiako Portua. Free Wifi is available throughout the property and Biarritz La Négresse Train Station is 7.4 miles away.

The apartment consists of 2 bedrooms, a living room, a fully equipped kitchen with a dishwasher and a coffee machine, and 2 bathrooms with a shower and a hair dryer. Towels and bed linen are provided in the apartment. The accommodation is non-smoking.

Dining options are available close to the apartment.

The nearest airport is Biarritz Airport, 3.1 miles from Spacieux Cosy HyperCentre.",https://www.booking.com/hotel/fr/spacieux-cosy-hypercentre-bayonne.html?label=gen173nr-1FEgZzZWFyY2goggI46AdIM1gEaK0CiAEBmAExuAEYyAEV2AEB6AEB-AECiAIBqAIEuAK8j6yrBsACAdICJGI0YjY2Y2VhLWU2YjAtNDc4ZC1hNDdiLTdlMjAxOTM1YmNiZNgCBeACAQ&sid=3bf0d1c36234319f0ce4698b5e5a9312&aid=304142&ucfs=1&arphpl=1&dest_id=-1410844&dest_type=city&group_adults=2&req_adults=2&no_rooms=1&group_children=0&req_children=0&hpos=24&hapos=24&sr_order=popularity&srpvid=1f7e4a1e9634011a&srepoch=1701513150&from=searchresults,43.4902052,-1.4738579
185,Aigues Mortes,La Maison de Lyna," 22 Boulevard Gambetta, 30220 Aigues-Mortes, France ",Wonderful,9.1,217 reviews,"['Free parking', 'Free WiFi', 'Non-smoking rooms', 'Free parking', 'Free WiFi', 'Non-smoking rooms', 'Accessible parking', 'Coffee machine', 'Electric kettle', 'Refrigerator', 'Linens', 'Wardrobe or closet', 'Toilet paper', 'Towels', 'Bathtub or shower', 'Private Bathroom', 'Toilet', 'Free toiletries', 'Hairdryer', 'Shower', 'Sitting area', 'Flat-screen TV', 'TV', 'Socket near the bed', 'Clothes rack', 'Tile/Marble floor', 'Private entrance', 'Tea/Coffee maker', 'Private apartment in building', 'Invoice provided', 'Air conditioning', 'Smoke-free property', 'Heating', 'Non-smoking rooms', 'Fire extinguishers', 'Smoke alarms', 'Key access', 'French']","Offering air-conditioned rooms in the Aigues-Mortes Medieval City district of Aigues-Mortes, La Maison de Lyna is 15 miles from Montpellier Arena. During your time at this recently renovated condo hotel, dating back to 19th century, you'll have access to free Wifi. When staying at the condo hotel, guests can use private entrance.

At the condo hotel, each unit is fitted with a wardrobe, a flat-screen TV, a private bathroom, bed linen, and towels. A fridge is also available, as well as a coffee machine and a kettle. At the condo hotel, every unit is equipped with a seating area.

Parc des Expositions de Montpellier is 15 miles from La Maison de Lyna, while Zenith Sud Montpellier is 17 miles from the property. The nearest airport is Montpellier - Mediterranee Airport, 18 miles from the accommodation.",https://www.booking.com/hotel/fr/la-maison-de-lyna.html?label=gen173nr-1FEgZzZWFyY2goggI46AdIM1gEaK0CiAEBmAExuAEYyAEV2AEB6AEB-AECiAIBqAIEuAK8j6yrBsACAdICJDM5N2U3NDhjLWM4MDAtNDhhYy1hY2U5LTQ2ZjU5ZGRhZWI0ONgCBeACAQ&sid=ff451afaa2ea1eac7df80483f821733d&aid=304142&ucfs=1&arphpl=1&dest_id=-1406800&dest_type=city&group_adults=2&req_adults=2&no_rooms=1&group_children=0&req_children=0&hpos=3&hapos=3&sr_order=popularity&srpvid=287e4a1eeef30052&srepoch=1701513150&from=searchresults,43.5660175,4.1923532
186,Aigues Mortes,La Villa Mazarin," 35 boulevard Gambetta, 30220 Aigues-Mortes, France ",Wonderful,9.2,832 reviews,"['Indoor swimming pool', 'Private Parking', 'Free WiFi', 'Restaurant', 'Family rooms', 'Fitness center', 'Non-smoking rooms', 'Facilities for disabled guests', 'Bar', 'Exceptional Breakfast', 'Indoor swimming pool', 'Private Parking', 'Free WiFi', 'Restaurant', 'Family rooms', 'Fitness center', 'Non-smoking rooms', 'Facilities for disabled guests', 'Bar', 'Exceptional Breakfast', 'Bathtub or shower', 'Slippers', 'Private Bathroom', 'Toilet', 'Free toiletries', 'Bathrobe', 'Hairdryer', 'Outdoor furniture', 'Sun deck', 'Terrace', 'Garden', 'Telephone', 'TV', 'Coffee house on site', 'Wine/Champagne', ""Kids' meals"", 'Bar', 'Minibar', 'Restaurant', 'Parking garage', 'Accessible parking', 'Invoice provided', 'Private check-in/out', 'Concierge', 'Baggage storage', 'Express check-in/out', '24-hour front desk', 'Daily housekeeping', 'Ironing service', 'Dry cleaning', 'Laundry', 'Fax/Photocopying', 'Fire extinguishers', 'CCTV outside property', 'CCTV in common areas', 'Smoke alarms', 'Security alarm', '24-hour security', 'Safe', 'Designated smoking area', 'Air conditioning', 'Smoke-free property', 'Tile/Marble floor', 'Heating', 'Elevator', 'Family rooms', 'Facilities for disabled guests', 'Non-smoking rooms', 'Room service', 'Visual aids (Braille)', 'Raised toilet', 'Toilet with grab rails', 'Wheelchair accessible', 'Opening times', 'Seasonal', 'All ages welcome', 'Infinity pool', 'Beach chairs/Loungers', 'Fitness', 'Full-body massage', 'Hand massage', 'Head massage', ""Couples' massage"", 'Foot massage', 'Neck massage', 'Back massage', 'Beach chairs/Loungers', 'Turkish/Steam Bath', 'Hot tub/Jacuzzi', 'Massage', 'Solarium', 'Fitness center', 'Sauna', 'English', 'Spanish', 'French', 'Italian']","Set in a building dating from the 15th century, La Villa Mazarin is located in the fortified city of Aigues-Mortes. It offers a terrace and guests can enjoy a drink at the bar. Free WiFi is available throughout.

The guest rooms have air conditioning, heating, satellite TV, a telephone and a fridge. All rooms are furnished in 17th-century Provençale style.

In the hotel's restaurant, Salon Mazarin, you can enjoy French culinary specialties or choose from a selection of light meals and snacks. The salon opens onto the courtyard and sun terrace.

Montpellier is 16 mi from La Villa Mazarin, while Nîmes is 20 mi away. The nearest airport is Mediterranee Airport, 12 mi from the property.",https://www.booking.com/hotel/fr/la-villa-mazarin.html?label=gen173nr-1FEgZzZWFyY2goggI46AdIM1gEaK0CiAEBmAExuAEYyAEV2AEB6AEB-AECiAIBqAIEuAK8j6yrBsACAdICJDM5N2U3NDhjLWM4MDAtNDhhYy1hY2U5LTQ2ZjU5ZGRhZWI0ONgCBeACAQ&sid=ff451afaa2ea1eac7df80483f821733d&aid=304142&ucfs=1&arphpl=1&dest_id=-1406800&dest_type=city&group_adults=2&req_adults=2&no_rooms=1&group_children=0&req_children=0&hpos=1&hapos=1&sr_order=popularity&srpvid=287e4a1eeef30052&srepoch=1701513150&from=searchresults,43.56498662,4.19175196
187,Bayonne,Duplex Typique Centre Bayonne," 3 rue Pannecau, 64100 Bayonne, France ",Wonderful,9.0,44 reviews,"['Free WiFi', 'Non-smoking rooms', 'Free WiFi', 'Non-smoking rooms', 'Dining table', 'Coffee machine', 'Cleaning products', 'Toaster', 'Oven', 'Kitchenware', 'Electric kettle', 'Kitchen', 'Washing machine', 'Dishwasher', 'Microwave', 'Refrigerator', 'Linens', 'Wardrobe or closet', 'Toilet paper', 'Towels', 'Bathtub or shower', 'Shared toilet', 'Private Bathroom', 'Hairdryer', 'Bathtub', 'Shower', 'Dining area', 'Sofa', 'Sitting area', 'Desk', 'Streaming service (like Netflix)', 'Flat-screen TV', 'Cable channels', 'Satellite channels', 'TV', 'Sofa bed', 'Drying rack for clothing', 'Hardwood or parquet floors', 'Heating', 'Fan', 'Ironing facilities', 'Iron', 'Upper floors accessible by stairs only', 'Coffee house on site', 'Tea/Coffee maker', 'Bar crawls', 'Beach', 'Water sports facilities on site', 'Snorkeling', 'Diving', 'Hiking', 'Evening entertainment', 'Board games/puzzles', 'Smoke-free property', 'Non-smoking rooms', 'Carbon monoxide detector', 'English', 'Spanish', 'French']","Duplex Typique Centre Bayonne in Bayonne features accommodations with free Wifi, 7.4 miles from Biarritz La Négresse Train Station, 14 miles from Saint Jean de Luz Train Station, and 14 miles from Saint Jean Baptiste Church. The property is around 22 miles from Hendaye Train Station, 22 miles from FICOBA, and 30 miles from Pasaiako Portua.

This apartment includes 2 bedrooms, a living room and a flat-screen TV, an equipped kitchen with a dining area, and 1 bathroom with a bath and a washing machine. Towels and bed linen are offered in the apartment. The accommodation is non-smoking.

There is an on-site coffee shop.

Guests at the apartment will be able to enjoy activities in and around Bayonne, like pub crawls. Snorkeling, diving, and hiking are possible within the area, and Duplex Typique Centre Bayonne offers water sports facilities.

The nearest airport is Biarritz Airport, 3.1 miles from the accommodation.",https://www.booking.com/hotel/fr/duplex-typique-centre-bayonne.html?label=gen173nr-1FEgZzZWFyY2goggI46AdIM1gEaK0CiAEBmAExuAEYyAEV2AEB6AEB-AECiAIBqAIEuAK8j6yrBsACAdICJGI0YjY2Y2VhLWU2YjAtNDc4ZC1hNDdiLTdlMjAxOTM1YmNiZNgCBeACAQ&sid=3bf0d1c36234319f0ce4698b5e5a9312&aid=304142&ucfs=1&arphpl=1&dest_id=-1410844&dest_type=city&group_adults=2&req_adults=2&no_rooms=1&group_children=0&req_children=0&hpos=23&hapos=23&sr_order=popularity&srpvid=1f7e4a1e9634011a&srepoch=1701513150&from=searchresults,43.489894,-1.473892
188,Bayonne,Libertitu," 44 avenue Maréchal Foch, double porte de gauche PAYS BASQUE, 64100 Bayonne, France ",Wonderful,9.2,177 reviews,"['Free parking', 'Free WiFi', 'Non-smoking rooms', 'Airport shuttle', 'Tea/Coffee Maker in All Rooms', 'Free parking', 'Free WiFi', 'Non-smoking rooms', 'Airport shuttle', 'Tea/Coffee Maker in All Rooms', 'Toilet paper', 'Towels', 'Private Bathroom', 'Toilet', 'Hairdryer', 'Shower', 'Linens', 'Coffee machine', 'Cleaning products', 'Toaster', 'Oven', 'Kitchenware', 'Electric kettle', 'Kitchen', 'Dishwasher', 'Microwave', 'Refrigerator', 'Drying rack for clothing', 'Sitting area', 'Streaming service (like Netflix)', 'Flat-screen TV', 'Cable channels', 'Satellite channels', 'TV', 'Coffee house on site', 'Breakfast in the room', 'Tea/Coffee maker', 'Street parking', 'Grocery deliveries', 'Daily housekeeping', 'Airport shuttle', 'Carbon monoxide detector', 'Smoke-free property', 'Hardwood or parquet floors', 'Interconnecting room(s) available', 'Elevator', 'Heating', 'Ironing facilities', 'Non-smoking rooms', 'Iron', 'Upper floors accessible by stairs only', 'Upper floors accessible by elevator', 'English', 'Spanish', 'French']","Libertitu enjoys a location in Bayonne, 7.3 miles from Biarritz La Négresse Train Station and 14 miles from Saint Jean de Luz Train Station. With free Wifi, this 3-star bed and breakfast offers an elevator and daily room service. Saint Jean Baptiste Church is 14 miles away, and Hendaye Train Station is 22 miles from the bed and breakfast.

The units come with parquet floors and feature a fully equipped kitchen with a dishwasher, a dining area, a flat-screen TV with streaming services, and a private bathroom with walk-in shower and a hair dryer. An oven, a microwave, and toaster are also available, as well as a coffee machine and a kettle. At the bed and breakfast, each unit has bed linen and towels.

There is a coffee shop, and a grocery delivery service is also available.

FICOBA is 22 miles from the bed and breakfast, while Pasaiako Portua is 29 miles from the property. The nearest airport is Biarritz, 3.1 miles from Libertitu, and the property offers a paid airport shuttle service.",https://www.booking.com/hotel/fr/libertitu.html?label=gen173nr-1FEgZzZWFyY2goggI46AdIM1gEaK0CiAEBmAExuAEYyAEV2AEB6AEB-AECiAIBqAIEuAK8j6yrBsACAdICJGI0YjY2Y2VhLWU2YjAtNDc4ZC1hNDdiLTdlMjAxOTM1YmNiZNgCBeACAQ&sid=3bf0d1c36234319f0ce4698b5e5a9312&aid=304142&ucfs=1&arphpl=1&dest_id=-1410844&dest_type=city&group_adults=2&req_adults=2&no_rooms=1&group_children=0&req_children=0&hpos=22&hapos=22&sr_order=popularity&srpvid=1f7e4a1e9634011a&srepoch=1701513150&from=searchresults,43.494486,-1.483622
189,Bayonne,Hotel Le Port Neuf," 44 Rue Port Neuf, 64100 Bayonne, France ",Very Good,8.2,656 reviews,"['Free WiFi', 'Non-smoking rooms', 'Bar', 'Free WiFi', 'Non-smoking rooms', 'Bar', 'Toilet paper', 'Towels', 'Bathtub or shower', 'Private Bathroom', 'Toilet', 'Free toiletries', 'Hairdryer', 'Shower', 'Wardrobe or closet', 'View', 'Outdoor furniture', 'Sun deck', 'Terrace', 'Socket near the bed', 'Drying rack for clothing', 'Clothes rack', 'Golf course (within 2 miles)', 'Flat-screen TV', 'Cable channels', 'Satellite channels', 'TV', 'Coffee house on site', 'Fruit', 'Wine/Champagne', 'Snack bar', 'Bar', 'Pet bowls', 'Daily housekeeping', 'Concierge', 'Express check-in/out', 'Fire extinguishers', 'CCTV in common areas', 'Smoke alarms', 'Security alarm', 'Key access', 'Smoke-free property', 'Hardwood or parquet floors', 'Heating', 'Soundproof rooms', 'Fan', 'Non-smoking rooms', 'Upper floors accessible by stairs only', 'English', 'Spanish', 'French']","Hotel Le Port Neuf is located in the historical center, 328 feet from Bayonne Cathedral and 984 feet from the Basque Museum. It offers free Wi-Fi access and an onsite bar with a terrace.

The rooms at Hotel Le Port Neuf are decorated in a contemporary style and include a flat-screen TV. There is also an private bathroom, which is complete with a hairdryer.

A continental breakfast is served every morning from 8:00 to 10.00, and local gastronomic restaurants can be found 984 feet from the property. The property also features an on-sit wine bar.

The hotel is also ideally located a 10-minute walk from the train station.",https://www.booking.com/hotel/fr/le-port-neuf.html?label=gen173nr-1FEgZzZWFyY2goggI46AdIM1gEaK0CiAEBmAExuAEYyAEV2AEB6AEB-AECiAIBqAIEuAK8j6yrBsACAdICJGI0YjY2Y2VhLWU2YjAtNDc4ZC1hNDdiLTdlMjAxOTM1YmNiZNgCBeACAQ&sid=3bf0d1c36234319f0ce4698b5e5a9312&aid=304142&ucfs=1&arphpl=1&dest_id=-1410844&dest_type=city&group_adults=2&req_adults=2&no_rooms=1&group_children=0&req_children=0&hpos=21&hapos=21&sr_order=popularity&srpvid=1f7e4a1e9634011a&srepoch=1701513150&from_sustainable_property_sr=1&from=searchresults,43.49166881,-1.47638239
190,Bayonne,Hôtel Le Bayonne," 1 Avenue Jean Rostand , 64100 Bayonne, France ",Very Good,8.2,"1,007 reviews","['Outdoor swimming pool', 'Private Parking', 'Free WiFi', 'Family rooms', 'Restaurant', 'Facilities for disabled guests', 'Non-smoking rooms', 'Tea/Coffee Maker in All Rooms', 'Bar', 'Good Breakfast', 'Outdoor swimming pool', 'Private Parking', 'Free WiFi', 'Family rooms', 'Restaurant', 'Facilities for disabled guests', 'Non-smoking rooms', 'Tea/Coffee Maker in All Rooms', 'Bar', 'Good Breakfast', 'Toilet paper', 'Towels', 'Private Bathroom', 'Toilet', 'Free toiletries', 'Hairdryer', 'Shower', 'Linens', 'Wardrobe or closet', 'View', 'Terrace', 'Socket near the bed', 'Live music/Performance', 'Tour or class about local culture', 'Bike tours', 'Walking tours', 'Horseback riding', 'Bowling', 'Cycling', 'Hiking', 'Canoeing', 'Fishing', 'Golf course (within 2 miles)', 'Tennis court', 'Desk', 'Flat-screen TV', 'Telephone', 'TV', 'Fruit', ""Kids' meals"", 'Snack bar', 'Breakfast in the room', 'Bar', 'Restaurant', 'Tea/Coffee maker', 'Accessible parking', 'Concierge', 'Baggage storage', '24-hour front desk', 'Daily housekeeping', 'Suit press', 'Ironing service', 'Laundry', 'Fax/Photocopying', 'Meeting/Banquet facilities', 'Fire extinguishers', 'Smoke alarms', 'Security alarm', 'Key card access', 'Safe', 'Air conditioning', 'Smoke-free property', 'Wake-up service', 'Hardwood or parquet floors', 'Heating', 'Soundproof', 'Soundproof rooms', 'Elevator', 'Family rooms', 'Facilities for disabled guests', 'Non-smoking rooms', 'Room service', 'Wheelchair accessible', 'Upper floors accessible by elevator', 'Seasonal', 'Infinity pool', 'Beach chairs/Loungers', 'Spa lounge/Relaxation area', 'Beach umbrellas', 'Beach chairs/Loungers', 'Turkish/Steam Bath', 'Sauna', 'English', 'Spanish', 'French', 'Italian', 'Portuguese']","Set in central Bayonne in the Aquitaine region, Hôtel Le Bayonne offers a seasonal, outdoor swimming pool. Guests are invited to use the hammam.

Free fiber-optic Internet access and a flat-screen TV with satellite channels are provided in each of Hôtel Le Bayonne rooms. They are all air-conditioned and include work desks and telephones.

Traditional cuisine is proposed in the restaurant at Hôtel Le Bayonne, and drinks are served in the bar. Breakfast can be enjoyed daily in the breakfast area or in the comfort of guest rooms.

Bayonne Train Station is 1.9 mi away and private parking is available with a supplement. The hotel is 4.7 mi from Biarritz and 3.4 mi from the Biarritz-Anglet-Bayonne Airport.",https://www.booking.com/hotel/fr/le-bayonne-ha-tel.html?label=gen173nr-1FEgZzZWFyY2goggI46AdIM1gEaK0CiAEBmAExuAEYyAEV2AEB6AEB-AECiAIBqAIEuAK8j6yrBsACAdICJGI0YjY2Y2VhLWU2YjAtNDc4ZC1hNDdiLTdlMjAxOTM1YmNiZNgCBeACAQ&sid=3bf0d1c36234319f0ce4698b5e5a9312&aid=304142&ucfs=1&arphpl=1&dest_id=-1410844&dest_type=city&group_adults=2&req_adults=2&no_rooms=1&group_children=0&req_children=0&hpos=20&hapos=20&sr_order=popularity&srpvid=1f7e4a1e9634011a&srepoch=1701513150&from=searchresults,43.4850262,-1.47537053
191,Bayonne,Appartement au coeur de Bayonne sur les remparts," 5 Rue des Faures, 64100 Bayonne, France ",Wonderful,9.2,96 reviews,"['Parking on site', 'Free WiFi', 'Non-smoking rooms', 'Parking on site', 'Free WiFi', 'Non-smoking rooms', 'Street parking', 'High chair', 'Dining table', 'Coffee machine', 'Cleaning products', 'Toaster', 'Stovetop', 'Oven', 'Dryer', 'Kitchenware', 'Electric kettle', 'Kitchen', 'Washing machine', 'Dishwasher', 'Microwave', 'Refrigerator', 'Linens', 'Wardrobe or closet', 'Toilet paper', 'Towels', 'Towels/Sheets (extra fee)', 'Bathtub or shower', 'Private Bathroom', 'Toilet', 'Shower', 'Dining area', 'Sofa', 'Sitting area', 'Flat-screen TV', 'Socket near the bed', 'Clothes rack', 'Hypoallergenic', 'Hardwood or parquet floors', 'Tile/Marble floor', 'Soundproof', 'Private entrance', 'Outdoor furniture', 'Outdoor dining area', 'Terrace', 'Tea/Coffee maker', 'Golf course (within 2 miles)', 'City view', 'View', 'Private apartment in building', 'Invoice provided', 'Smoke-free property', 'Heating', 'Soundproof rooms', 'Non-smoking rooms', 'English']","Appartement au coeur de Bayonne sur les remparts offers accommodations in Bayonne, 22 miles from Hendaye Train Station and 22 miles from FICOBA. This sustainable apartment is located 14 miles from Saint Jean de Luz Train Station and 14 miles from Saint Jean Baptiste Church. Free Wifi is available throughout the property and Biarritz La Négresse Train Station is 7.5 miles away.

Featuring a terrace with city views, this apartment also comes with a flat-screen TV, a well-equipped kitchen with a dishwasher, an oven, and a microwave, as well as 1 bathroom with a shower. This apartment is allergy-free and non-smoking.

Pasaiako Portua is 30 miles from the apartment. The nearest airport is Biarritz Airport, 3.1 miles from Appartement au coeur de Bayonne sur les remparts.",https://www.booking.com/hotel/fr/5-rue-des-faures.html?label=gen173nr-1FEgZzZWFyY2goggI46AdIM1gEaK0CiAEBmAExuAEYyAEV2AEB6AEB-AECiAIBqAIEuAK8j6yrBsACAdICJGI0YjY2Y2VhLWU2YjAtNDc4ZC1hNDdiLTdlMjAxOTM1YmNiZNgCBeACAQ&sid=3bf0d1c36234319f0ce4698b5e5a9312&aid=304142&ucfs=1&arphpl=1&dest_id=-1410844&dest_type=city&group_adults=2&req_adults=2&no_rooms=1&group_children=0&req_children=0&hpos=19&hapos=19&sr_order=popularity&srpvid=1f7e4a1e9634011a&srepoch=1701513150&from_sustainable_property_sr=1&from=searchresults,43.4893908,-1.4790953
